{
  "job_id": "8d2c1e40-5b3a-4a8e-9021-e73e7a01f944",
  "engine": "repository",
  "status": "ok",
  "findings": [
    {
      "id": "REPO_SEALED",
      "severity": "info",
      "title": "Analysis report cryptographically committed to Merkle repository",
      "evidence": "Entry index 17, signed with mt-signer-1, simulated block height 3"
    }
  ],
  "entry_index": 17,
  "canonical_report_sha256": "44136fa355b3678a1146ad16f7e8649e94fb4fc21fe77e8310c060f61caaff8a",
  "prev_entry_hash": "2f4b39a8c1e05d97f382a9b6c4e019348f9a23b1c67e89a01b2345c6789def01",
  "entry_hash": "8d3e2a1b9c8f7e6d5c4b3a20192837465f0e1d2c3b4a59687e8f9a0b1c2d3e4f",
  "signature": "MEQCICcOJsbLDJygCOL8e90piu8v7mSXFDfYHPKlRunY/mmDAiBimAe0PNmgUHbMimqaBtd5J4mnwq8SMU/uw+qMXoRrAw==",
  "pubkey_id": "mt-signer-1",
  "repo_merkle_root": "8d3e2a1b9c8f7e6d5c4b3a20192837465f0e1d2c3b4a59687e8f9a0b1c2d3e4f",
  "inclusion_proof": [
    {
      "sibling": "a1b2c3d4e5f60718293a4b5c6d7e8f90123456789abcdef0123456789abcdef0",
      "position": "left"
    }
  ],
  "timestamp": "2026-09-29T02:00:00.000000+00:00",
  "sim_block": {
    "height": 3,
    "block_hash": "98040f27c7738131cfc1912c0594344b721eba5bf7c437107947001d61060dac",
    "tx_id": "8d3e2a1b9c8f7e6d5c4b3a2019283746",
    "simulated": true
  }
}
